{
  "accepted": true,
  "authority": {
    "owner_authority_self_sha256": "2d22784971502b1e17dae553cbd559e6efa9cee2303c945c8603000e0278d88c",
    "package_sha256": "f637b90fd1249217005ff0eb646ee06a5b3b00cbc91609274718aced007bb0f1",
    "population_count": 200,
    "population_sha256": "101fb166147195013ede721c68ac2dc2cef9445865436c8cf130a0dd2addd580",
    "root_cause_self_sha256": "3359cc08b48b98a4a3d00dfbedf64ed91509c300e5447bf3e5c16e12c974f32c",
    "unified_m26_v3_sha256": "6e71ca5981e3eb45987d188c9c7fb2851a4b5f31803655dd2fc7e28ed4bd22a9"
  },
  "authority_boundary": {
    "m26_closed": false,
    "pa6_canary_authorized": false,
    "pa6_canary_traffic": false,
    "pa7_authorized": false,
    "production_pointer_mutation": false,
    "production_serving": false,
    "public_traffic": false,
    "r2_qdrant_source_foundation_release_mutations": 0
  },
  "calibration_governance": {
    "cumulative_calibration_cost_usd": "0.02610858",
    "cumulative_calibration_provider_calls": 146,
    "maximum_calibration_cost_usd": "20.00",
    "maximum_calibration_provider_calls": 640,
    "total_rounds_consumed": 3,
    "two_unique_consecutive_passes_on_same_head_and_sample": true
  },
  "calibrations": [
    {
      "artifact_archive_digest": "sha256:4a8a9f7bbd71f7f0d33d1e26802552d01de0183c5ad0f2c7b2b11be0aa510c1f",
      "artifact_id": 8745481770,
      "artifact_name": "m26-pa5-v8-calibration-30506281017",
      "executable_head_sha": "1f09dd3f6266d6632036347c26d8ad4fa66024da",
      "job_id": 90756649210,
      "metrics": {
        "answerable_grounded_quality_pass_rate": 1.0,
        "appropriate_abstention_recall": 1.0,
        "citation_locator_validity": 1.0,
        "complete_accounting": 35,
        "mandatory_abstention_correctness": 1.0,
        "material_claim_support_precision": 1.0,
        "mean_payg_equivalent_cost_usd": "0.0003829817142857142857142857143",
        "over_abstention_on_answerable": 0.0,
        "p95_latency_ms": 9161,
        "p95_payg_equivalent_cost_usd": "0.000555234",
        "p99_latency_ms": 13341,
        "payg_equivalent_cost_usd": "0.01340436",
        "post_repair_disagreement_rate": 0.0,
        "provider_calls": 74,
        "provider_error_rate": 0.0,
        "resolved_by_safe_abstention": 0,
        "safe_terminal_outcome_rate": 1.0,
        "unresolved_disagreements": 0,
        "unsupported_accepted_claims": 0,
        "wall_clock_seconds": 156.853
      },
      "privacy": {
        "full_provider_response_persisted": false,
        "raw_evidence_persisted": false,
        "raw_query_persisted": false,
        "secret_values_persisted": false,
        "vectors_persisted": false
      },
      "receipt_file_sha256": "c0df7d90371ac741d09d3d60f84d17adc55305b25128179e1096ad5e433d0f2d",
      "receipt_self_sha256": "da975395b9893381b31e6378c46330590f65accbba02bcd8ba211254ef059106",
      "run_attempt": 1,
      "run_event": "push",
      "run_id": 30506281017,
      "sample_sha256": "68e7515b20755f40e949beaed6b8603cc5541c52c91cac470b63f0b88ad32f3d",
      "sequence": 1,
      "status": "passed",
      "stratum_counts": {
        "abstention_no_answer": 5,
        "conflict_and_temporal_freshness": 5,
        "cross_document_comparison": 5,
        "direct_grounded_factual": 5,
        "graph_navigation": 5,
        "prompt_injection_privacy_adversarial": 5,
        "provenance_and_source_trace": 5
      },
      "trigger_merge_sha": "85c3c3c0497b8ab61b203faed51d6e5d136445e7",
      "trigger_pull_request": 1236
    },
    {
      "artifact_archive_digest": "sha256:29bb826d48baa7802d89ffce08d537507ae8fb9b366879a46ae00a16f8158936",
      "artifact_id": 8745768484,
      "artifact_name": "m26-pa5-v8-calibration-30507033314",
      "executable_head_sha": "1f09dd3f6266d6632036347c26d8ad4fa66024da",
      "job_id": 90758925727,
      "metrics": {
        "answerable_grounded_quality_pass_rate": 0.96,
        "appropriate_abstention_recall": 1.0,
        "citation_locator_validity": 1.0,
        "complete_accounting": 35,
        "mandatory_abstention_correctness": 1.0,
        "material_claim_support_precision": 1.0,
        "mean_payg_equivalent_cost_usd": "0.0003629777142857142857142857143",
        "over_abstention_on_answerable": 0.04,
        "p95_latency_ms": 11397,
        "p95_payg_equivalent_cost_usd": "0.00045384",
        "p99_latency_ms": 13861,
        "payg_equivalent_cost_usd": "0.01270422",
        "post_repair_disagreement_rate": 0.02857142857142857,
        "provider_calls": 72,
        "provider_error_rate": 0.0,
        "resolved_by_safe_abstention": 1,
        "safe_terminal_outcome_rate": 1.0,
        "unresolved_disagreements": 0,
        "unsupported_accepted_claims": 0,
        "wall_clock_seconds": 176.894
      },
      "privacy": {
        "full_provider_response_persisted": false,
        "raw_evidence_persisted": false,
        "raw_query_persisted": false,
        "secret_values_persisted": false,
        "vectors_persisted": false
      },
      "receipt_file_sha256": "31d3aa8aac6a26fb9605c8b8c982c110674f76dfe9f25761eac7b044b3d3aaaf",
      "receipt_self_sha256": "abfb5f6cc813b2b5df78e491b0ee6b37c7944bc1e796f5478e127608fa1ffe09",
      "run_attempt": 1,
      "run_event": "push",
      "run_id": 30507033314,
      "sample_sha256": "68e7515b20755f40e949beaed6b8603cc5541c52c91cac470b63f0b88ad32f3d",
      "sequence": 2,
      "status": "passed",
      "stratum_counts": {
        "abstention_no_answer": 5,
        "conflict_and_temporal_freshness": 5,
        "cross_document_comparison": 5,
        "direct_grounded_factual": 5,
        "graph_navigation": 5,
        "prompt_injection_privacy_adversarial": 5,
        "provenance_and_source_trace": 5
      },
      "trigger_merge_sha": "4e65281e3d258bab376cfadbd16b456911780fd5",
      "trigger_pull_request": 1237
    }
  ],
  "effective_only_on_reconciliation_merge": true,
  "formal_attempt_9": {
    "artifact_archive_digest": "sha256:3b8b8575561b382a23eb486f6fd060308df9621973ce2e29c75bb648958d3493",
    "artifact_id": 8746169278,
    "artifact_name": "m26-pa-5-controlled-internal-shadow-pilot-evidence-attempt-9",
    "artifact_size_in_bytes": 38454,
    "executable_head_sha": "1f09dd3f6266d6632036347c26d8ad4fa66024da",
    "job_id": 90760711733,
    "metrics": {
      "answerable_grounded_quality_pass_rate": 1.0,
      "appropriate_abstention_recall": 1.0,
      "citation_locator_validity": 1.0,
      "complete_accounting": 200,
      "mandatory_abstention_correctness": 1.0,
      "material_claim_support_precision": 1.0,
      "mean_payg_equivalent_cost_usd": "0.0003495615",
      "over_abstention_on_answerable": 0.0,
      "p95_latency_ms": 13257,
      "p95_payg_equivalent_cost_usd": "0.00043860",
      "p99_latency_ms": 19212,
      "payg_equivalent_cost_usd": "0.06991230",
      "post_repair_disagreement_rate": 0.0,
      "provider_calls": 406,
      "provider_error_rate": 0.0,
      "resolved_by_safe_abstention": 0,
      "safe_terminal_outcome_rate": 1.0,
      "unresolved_disagreements": 0,
      "unsupported_accepted_claims": 0,
      "wall_clock_seconds": 939.399
    },
    "privacy": {
      "full_provider_response_persisted": false,
      "raw_evidence_persisted": false,
      "raw_query_persisted": false,
      "secret_values_persisted": false,
      "vectors_persisted": false
    },
    "receipt_file_sha256": "37658985b3974924ec9a6fa3f7a9ebedd92135670becd01bb0432e0120fa1582",
    "receipt_self_sha256": "316995b3d7ad01260c9bcd69c1a0775d5301d914847ff578b82abff84cd62e9d",
    "receipt_status": "passed",
    "run_attempt": 1,
    "run_event": "push",
    "run_id": 30507628057,
    "stratum_counts": {
      "abstention_no_answer": 15,
      "conflict_and_temporal_freshness": 15,
      "cross_document_comparison": 20,
      "direct_grounded_factual": 90,
      "graph_navigation": 20,
      "prompt_injection_privacy_adversarial": 10,
      "provenance_and_source_trace": 30
    },
    "trigger_merge_sha": "6935674474130db53589ba023b98119aa701703e",
    "trigger_pull_request": 1238,
    "workflow_name": "M26.PA.5 v8 PA.4-Kernel Orchestrated Pilot"
  },
  "generated_at": "2026-07-30T02:29:05Z",
  "implementation": {
    "base_sha": "9cfa3cf5c6e99d020de815b2fb8802ea9a987a9c",
    "changed_file_count": 9,
    "expected_head_merge": true,
    "head_sha": "18929604b38008cc3be9a066a8b5e861265c5e26",
    "merge_sha": "31288b0dc966af2df55923f504d63cea9f02ac58",
    "pull_request": 1233,
    "review_count": 0,
    "unresolved_review_thread_count": 0
  },
  "issue": {
    "number": 1239,
    "repository": "danielcanfly/knowledge-engine",
    "state_before_reconciliation_pr": "open",
    "title": "M26.PA.5 v8 acceptance reconciliation"
  },
  "next_stage": {
    "canary_traffic_permitted": false,
    "daniel_owner_canary_gate_required": true,
    "m26_closed": false,
    "name": "Canary, SLO, and Rollback",
    "pa6_unlock_status_after_reconciliation_merge": "m26_pa_6_unlocked_pending_owner_canary_approval",
    "predecessor_status_required": "m26_pa_5_controlled_internal_shadow_pilot_accepted",
    "production_answer_serving_permitted": false,
    "production_pointer_mutation_permitted": false,
    "stage_id": "M26.PA.6"
  },
  "operation_counts": {
    "canonical_writes": 0,
    "production_pointer_mutations": 0,
    "provider_calls": 406,
    "public_shadow_canary_traffic_operations": 0,
    "qdrant_writes": 0,
    "r2_writes": 0,
    "source_foundation_release_mutations": 0
  },
  "owner_oversight_packet": {
    "blocking_dispute_count": 0,
    "packet_count": 20,
    "path": "pilot/m26/m26-pa-5-v8-owner-oversight-packet.json",
    "self_sha256": "d705ffa27fefdf949c37a97f1982661658cff3706a6ed228728e2f6f0f6655a0",
    "unresolved_disagreement_count": 0
  },
  "predecessor": {
    "pa4_acceptance_self_sha256": "0581fc85a34b106c3dce5ec9c27adc3c215a87008f30384da7f574bfcbf13ac7",
    "pa4_reconciliation_merge_sha": "3fcc4e5520db6d3cac7ce18004753c2549592afa",
    "pa4_reconciliation_pull_request": 1211,